{
  "action": "REQUEST_TEST_RUN",
  "request_id": "req-12-001",
  "plan_id": "plan-42",
  "test_run_id": "test-run-001",
  "target": {
    "repository": {
      "owner": "example-org",
      "name": "example-service"
    },
    "commit_sha": "0123456789abcdef0123456789abcdef01234567"
  },
  "requested_checks": ["UNIT", "INTEGRATION"]
}
